{
  "schemaVersion": "1.0.0",
  "runId": "20260915T230651774Z-project-orchestrator-architecture-ec398438-9f94-4e2f-b4c1-7419c279dbfd",
  "status": "partial",
  "source": {
    "repositoryDigestSha256": "8467ee1a3d9393426ae77bafbf4cad499f33d7c18593a8a3b62530bf7bfccd2f",
    "projectUnderstandingDigestSha256": "fb726011a8f0b29f5c208b2eaa0e058b2be4dfc5fba1e3f602895a32cccc7832"
  },
  "renderer": {
    "class": "deterministic-source",
    "name": "mermaid-source"
  },
  "artifacts": [
    {
      "path": "request.json",
      "mediaType": "application/json",
      "sha256": "c3d5a941b8ca53bf3ac2f1be031a90de3f62322fa3d5d3e2fdf4aac3939e57d0",
      "validated": true
    },
    {
      "path": "diagram.mmd",
      "mediaType": "text/vnd.mermaid",
      "sha256": "b7915cf6b78f08f6a6ff4e889ee3f2d3bb2a93f37b1f2f7a2ca7a11a4b909d49",
      "validated": true
    },
    {
      "path": "visual-specification.md",
      "mediaType": "text/markdown",
      "sha256": "ea576d997f62c605f501777e377fe92accc49007e156446b4df6dbdd10bde286",
      "validated": true
    },
    {
      "path": "evidence-map.md",
      "mediaType": "text/markdown",
      "sha256": "097689c67e0c80aac655131029d77ff5e4f5e894e00df35a2c7b9c96da984e36",
      "validated": true
    },
    {
      "path": "alt-text.md",
      "mediaType": "text/markdown",
      "sha256": "5fc85eaa5fe8219c9755005edbe9287e9529bec0d956bc50ba13f7359a1c8c34",
      "validated": true
    }
  ],
  "warnings": [],
  "limitations": [
    "No local SVG or PNG renderer is qualified for this technical diagram run."
  ]
}
